Routes,Links
Jodhpur to Ajmer,https://www.redbus.in/bus-tickets/jodhpur-to-ajmer
Beawar (Rajasthan) to Jaipur (Rajasthan),https://www.redbus.in/bus-tickets/beawer-to-jaipur
Jaipur (Rajasthan) to Jodhpur,https://www.redbus.in/bus-tickets/jaipur-to-jodhpur
Udaipur to Jodhpur,https://www.redbus.in/bus-tickets/udaipur-to-jodhpur
Sikar to Jaipur (Rajasthan),https://www.redbus.in/bus-tickets/sikar-to-jaipur
Jaipur (Rajasthan) to Pilani,https://www.redbus.in/bus-tickets/jaipur-to-pilani
Aligarh (uttar pradesh) to Jaipur (Rajasthan),https://www.redbus.in/bus-tickets/aligarh-uttar-pradesh-to-jaipur
Kishangarh (Rajasthan) to Jaipur (Rajasthan),https://www.redbus.in/bus-tickets/kishangarh-to-jaipur
Jodhpur to Beawar (Rajasthan),https://www.redbus.in/bus-tickets/jodhpur-to-beawer
