Routes,Links
Kolkata to Digha,https://www.redbus.in/bus-tickets/kolkata-to-digha
Digha to Kolkata,https://www.redbus.in/bus-tickets/digha-to-kolkata
Digha to Barasat (West Bengal),https://www.redbus.in/bus-tickets/digha-to-barasat-west-bengal
Durgapur (West Bengal) to Kolkata,https://www.redbus.in/bus-tickets/durgapur-to-kolkata
Midnapore to Kolkata,https://www.redbus.in/bus-tickets/midnapore-to-kolkata
Barasat (West Bengal) to Digha,https://www.redbus.in/bus-tickets/barasat-west-bengal-to-digha
Barasat (West Bengal) to Midnapore,https://www.redbus.in/bus-tickets/barasat-west-bengal-to-midnapore
Kolkata to Durgapur (West Bengal),https://www.redbus.in/bus-tickets/kolkata-to-durgapur
Barasat (West Bengal) to Nandakumar (west bengal),https://www.redbus.in/bus-tickets/barasat-west-bengal-to-nandakumar
Midnapore to Barasat (West Bengal),https://www.redbus.in/bus-tickets/midnapore-to-barasat-west-bengal
